"id","slug","name","tagline","description","address","phone","hours","cuisine","accent_color","cover_image_path","card_image_path","sort_order","created_at","updated_at"
"1","atoz-bar-wine-brasserie","AtoZ Bar Wine & Brasserie","Refined wine and small plates","An intimate brasserie with a sommelier-led wine program and seasonal small plates from a wood-fired hearth.","12 Vine Lane","+1 (555) 010-1001","Tue–Sun · 5pm–late","European · Wine Bar","#7a1f2b",,,"1","""2026-04-30T07:47:37.740Z""","""2026-04-30T07:47:37.740Z"""
"2","bosa-restaurant","Bosa Restaurant","Modern South Asian fine dining","A tasting-menu journey through coastal South Asia, reimagined with modern technique and theatre.","44 Marigold Street","+1 (555) 010-1002","Wed–Sun · 6pm–11pm","Modern South Asian","#c2410c",,,"2","""2026-04-30T07:47:37.740Z""","""2026-04-30T07:47:37.740Z"""
"3","bodega-all-day-dining","Bodega All Day Dining","Sun-up to sundown comfort","A laid-back all-day cafe pouring single-origin coffee in the morning and natural wine after dark.","9 Almond Court","+1 (555) 010-1003","Daily · 7am–11pm","Cafe · All-Day","#a16207",,,"3","""2026-04-30T07:47:37.740Z""","""2026-04-30T07:47:37.740Z"""
"4","lakers-by-atoz","Lakers By AtoZ","Lakeside seafood, slow afternoons","A breezy lakeside pavilion known for whole grilled fish, crudo, and gin-forward sundowners.","Pier 7, North Lake Promenade","+1 (555) 010-1004","Daily · 12pm–11pm","Coastal · Seafood","#0e7490",,,"4","""2026-04-30T07:47:37.740Z""","""2026-04-30T07:47:37.740Z"""
"5","redhare","Redhare","Cocktail-forward gastropub","A dimly lit gastropub with a 40-strong cocktail list and a kitchen that takes pub food seriously.","88 Carmine Street","+1 (555) 010-1005","Daily · 4pm–2am","Gastropub · Cocktails","#9f1239",,,"5","""2026-04-30T07:47:37.740Z""","""2026-04-30T07:47:37.740Z"""
"6","district5","District5","Industrial-chic global fusion","A warehouse dining room where Mediterranean, East Asian, and Latin American ideas share the pass.","5 Foundry Walk","+1 (555) 010-1006","Tue–Sun · 5:30pm–midnight","Global Fusion","#3f3f46",,,"6","""2026-04-30T07:47:37.740Z""","""2026-04-30T07:47:37.740Z"""
"7","infinity","Infinity","Rooftop fine dining","A rooftop counter with a single nightly tasting menu, an open kitchen, and an unbroken city skyline.","Roof, 200 Cedar Tower","+1 (555) 010-1007","Thu–Sun · 7pm–11pm","Tasting · Fine Dining","#1e293b",,,"7","""2026-04-30T07:47:37.740Z""","""2026-04-30T07:47:37.740Z"""
"8","oombee","Oombee","Playful Asian street food","A loud, joyful canteen pulling from Bangkok, Saigon, Penang and Seoul — eat with your hands.","23 Ribbon Alley","+1 (555) 010-1008","Daily · 11am–11pm","Asian Street Food","#15803d",,,"8","""2026-04-30T07:47:37.740Z""","""2026-04-30T07:47:37.740Z"""
"9","shiraz","Shiraz","Persian-Mediterranean kitchen","A sun-soaked kitchen built around saffron, charcoal, and shareable platters from the Levant to Esfahan.","31 Saffron Square","+1 (555) 010-1009","Tue–Sun · 12pm–11pm","Persian · Mediterranean","#b45309",,,"9","""2026-04-30T07:47:37.740Z""","""2026-04-30T07:47:37.740Z"""